{
  "derivation_id":       "derive_beagle_thin500_global_v1",
  "label":               "BEAGLE thinning — first valid site / 500 bp, per chromosome (global popstructure)",
  "operation_type":      "thin_by_distance",
  "parent_set_id":       "snps_maf005_v1",
  "operation_params_id": "thin500_first_per_chrom_v1",
  "filter_profile_id":   "popstruct_angsd_sites_v1",
  "coordinate_system":   "fClaHyb_Gar_LG_v1",
  "analysis_purpose":    "BEAGLE input for ngsRelate / NGSadmix / PCA",
  "software":            "custom-thin.py",
  "software_version":    "v1.0.0",
  "produces_set_id":     "sites_beagle_thin500_global_v1",
  "output_hash":         "sha256:8a7c9d5e4b2f1a3c6e0d9b8a7c5d4e3f2a1b0c9d8e7f6a5b4c3d2e1f0a9b8c7d",
  "created_at":          "2026-04-08T11:42:00Z",
  "status":              "active"
}
