{
  "derivation_id":       "derive_lostruct_LG28_v1",
  "label":               "lostruct LG28 100-site windows",
  "operation_type":      "window_extract",
  "parent_set_id":       "snps_maf005_v1",
  "operation_params_id": "lostruct_LG28_params_v1",
  "filter_profile_id":   "lostruct_site_filter_v1",
  "coordinate_system":   "fClaHyb_Gar_LG_v1",
  "analysis_purpose":    "local PCA inversion scan",
  "software":            "lostruct",
  "software_version":    "v0.0.0.9000",
  "produces_set_id":     "sites_lostruct_LG28_v1",
  "created_at":          "2026-04-10T12:00:00Z",
  "status":              "active"
}
